{
  "schema_version": 1,
  "version": "2.0.0-beta.1",
  "tag": "v2.0.0-beta.1",
  "candidate_sha": null,
  "candidate_tree": null,
  "candidate_cargo_target_dir": null,
  "main_sha": null,
  "main_tree": null,
  "receipts": {
    "parity": {"path": null, "sha256": null, "measured_sha": null, "measured_tree": null, "status": "unverified"},
    "documentation": {"path": null, "sha256": null, "measured_sha": null, "measured_tree": null, "status": "unverified"}
  },
  "packaging": {
    "prerelease": true,
    "latest": false,
    "targets": [],
    "expected_assets": []
  },
  "version_inventory": [],
  "version_reconciliation": {
    "status": "unverified",
    "path": null,
    "sha256": null,
    "scan_sha256": null,
    "tracked_files": null,
    "matching_lines": null,
    "reconciled_files": null,
    "reconciled_lines": null,
    "unresolved": []
  },
  "promotion": {
    "pr_url": null,
    "review_decision": null,
    "required_checks_status": null,
    "unresolved_actionable_threads": null,
    "review_threads_evidence": null,
    "review_threads_sha256": null,
    "pr_state_evidence": null,
    "pr_state_sha256": null,
    "required_checks_evidence": null,
    "required_checks_sha256": null
  },
  "authorization": {
    "authorized_by": null,
    "authorized_at": null,
    "version": null,
    "tag": null,
    "main_sha": null,
    "evidence_path": null
  },
  "tag_verification": {
    "status": "unverified",
    "tag": null,
    "target_sha": null,
    "signature": null,
    "evidence_path": null
  },
  "gates": [],
  "workflows": [],
  "artifacts": [],
  "macos_verification": {
    "status": "unverified",
    "release_run_id": null,
    "run_artifact_manifest": null,
    "raw_binary_artifact": null,
    "dmg_artifact": null,
    "expected_developer_id": null,
    "expected_team_identifier": null,
    "observed_developer_id": null,
    "observed_team_identifier": null,
    "raw_binary_sha256": null,
    "dmg_sha256": null,
    "dmg_payload_sha256": null,
    "payload_match": false,
    "reported_version": null,
    "gatekeeper_status": "unverified",
    "stapler_status": "unverified",
    "cleanup_status": "unverified",
    "evidence": []
  },
  "status": "blocked",
  "next_action": "name the next safe action"
}
